Question_Type,Question_Number,Question,Option_A,Option_B,Option_C,Option_D,Answer
MCQ,1,A good source of energy should be:,Easily available,Cheap,Easy to store and transport,All of the above,All of the above
MCQ,2,Fossil fuels are:,Renewable,Non-renewable,Clean,Abundant,Non-renewable
MCQ,3,The main disadvantage of fossil fuels is:,They are expensive,They cause pollution,They are difficult to extract,They are not efficient,They cause pollution
MCQ,4,Coal is a:,Renewable source,Non-renewable source,Nuclear source,Solar source,Non-renewable source
MCQ,5,Petroleum is a:,Renewable source,Non-renewable source,Nuclear source,Wind source,Non-renewable source
MCQ,6,Natural gas is a:,Renewable source,Non-renewable source,Nuclear source,Solar source,Non-renewable source
MCQ,7,Solar energy is a:,Conventional source,Non-conventional source,Nuclear source,Fossil fuel source,Non-conventional source
MCQ,8,Wind energy is a:,Conventional source,Non-conventional source,Nuclear source,Fossil fuel source,Non-conventional source
MCQ,9,Hydroelectric energy is a:,Conventional source,Non-conventional source,Nuclear source,Fossil fuel source,Conventional source
MCQ,10,Biomass is a:,Renewable source,Non-renewable source,Nuclear source,Fossil fuel source,Renewable source
MCQ,11,The device used to convert solar energy into electricity is:,Solar cell,Solar panel,Photovoltaic cell,All of the above,All of the above
MCQ,12,Solar cells are made of:,Silicon,Copper,Aluminium,Iron,Silicon
MCQ,13,The main disadvantage of solar cells is:,High initial cost,Low efficiency,Both a and b,Low maintenance,Both a and b
MCQ,14,Wind energy is harnessed using:,Windmills,Wind turbines,Both a and b,Solar panels,Both a and b
MCQ,15,The minimum wind speed required for electricity generation is:,5 km/h,15 km/h,25 km/h,35 km/h,15 km/h
MCQ,16,Hydroelectric power is generated from:,Flowing water,Still water,Ocean waves,Tidal waves,Flowing water
MCQ,17,The energy stored in water in a dam is:,Kinetic energy,Potential energy,Chemical energy,Nuclear energy,Potential energy
MCQ,18,Ocean thermal energy conversion uses:,Temperature difference in ocean,Wind in ocean,Waves in ocean,Currents in ocean,Temperature difference in ocean
MCQ,19,Tidal energy is generated from:,Ocean waves,Wind,Sun,Both sun and moon,Both sun and moon
MCQ,20,Geothermal energy is obtained from:,Sun,Wind,Heat inside Earth,Water,Heat inside Earth
MCQ,21,Biogas is produced from:,Animal dung,Plant waste,Agricultural waste,All of the above,All of the above
MCQ,22,The main constituent of biogas is:,Methane,Ethane,Propane,Butane,Methane
MCQ,23,Nuclear energy is obtained from:,Fission of heavy nuclei,Fusion of light nuclei,Both a and b,Combustion,Both a and b
MCQ,24,The fuel used in nuclear power plants is:,Uranium,Coal,Petroleum,Natural gas,Uranium
MCQ,25,The disadvantage of nuclear energy is:,It produces radioactive waste,It is expensive,It requires strict safety measures,All of the above,All of the above
MCQ,26,The energy stored in fossil fuels is:,Chemical energy,Potential energy,Kinetic energy,Nuclear energy,Chemical energy
MCQ,27,The energy from burning fossil fuels is converted to:,Heat energy,Electrical energy,Both a and b,Mechanical energy,Both a and b
MCQ,28,CNG stands for:,Compressed Natural Gas,Compressed Nitrogen Gas,Compressed Neon Gas,Compressed Noble Gas,Compressed Natural Gas
MCQ,29,CNG is a cleaner fuel than:,Petrol,Diesel,Both a and b,Natural gas,Both a and b
MCQ,30,The energy obtained from biomass is:,Solar energy,Chemical energy,Wind energy,Nuclear energy,Chemical energy
MCQ,31,Biomass includes:,Wood,Agricultural waste,Animal waste,All of the above,All of the above
MCQ,32,The process of burning biomass to produce energy is:,Combustion,Decomposition,Oxidation,Reduction,Combustion
MCQ,33,Solar cookers work on the principle of:,Absorption of solar energy,Reflection of solar energy,Both a and b,Refraction of solar energy,Both a and b
MCQ,34,The efficiency of solar cells is approximately:,10-20%,20-30%,30-40%,40-50%,10-20%
MCQ,35,Wind farms are located in areas with:,High wind speed,Low wind speed,No wind,Constant wind speed,High wind speed
MCQ,36,The energy in a hydroelectric power plant is converted from:,Potential to kinetic to electrical,Kinetic to potential to electrical,Chemical to electrical,Nuclear to electrical,Potential to kinetic to electrical
MCQ,37,Tidal energy is:,Renewable,Non-renewable,Both,Neither,Renewable
MCQ,38,Geothermal energy is:,Renewable,Non-renewable,Both,Neither,Renewable
MCQ,39,The main advantage of renewable energy sources is:,They are unlimited,They are clean,They are sustainable,All of the above,All of the above
MCQ,40,The main disadvantage of renewable energy sources is:,They are expensive,They are not always available,They require large areas,All of the above,All of the above
MCQ,41,The greenhouse effect is caused by:,CO₂,Methane,Both a and b,Water vapor,Both a and b
MCQ,42,Acid rain is caused by:,SO₂,NO₂,Both a and b,CO₂,Both a and b
MCQ,43,The most abundant renewable energy source is:,Solar,Wind,Hydroelectric,Biomass,Solar
MCQ,44,Solar panels convert:,Light energy to electrical energy,Heat energy to electrical energy,Chemical energy to electrical energy,Nuclear energy to electrical energy,Light energy to electrical energy
MCQ,45,The energy of moving air is called:,Solar energy,Wind energy,Hydroelectric energy,Tidal energy,Wind energy
MCQ,46,The energy of flowing water is called:,Solar energy,Wind energy,Hydroelectric energy,Tidal energy,Hydroelectric energy
MCQ,47,Fuel cells convert:,Chemical energy to electrical energy,Heat energy to electrical energy,Light energy to electrical energy,Nuclear energy to electrical energy,Chemical energy to electrical energy
MCQ,48,The energy stored in food is:,Chemical energy,Potential energy,Kinetic energy,Nuclear energy,Chemical energy
MCQ,49,The unit of energy is:,Joule,Watt,Volt,Ampere,Joule
MCQ,50,1 kilowatt-hour is equal to:,3.6 × 10⁶ J,3.6 × 10³ J,3.6 × 10⁹ J,3.6 × 10¹² J,3.6 × 10⁶ J
Integer,1,1 kilowatt-hour = 3.6 × 10⁶ J. The exponent is: _____.,6,,,,
Integer,2,The minimum wind speed required for electricity generation is approximately _____ km/h.,15,,,,
Integer,3,The efficiency of solar cells is approximately 10-20%. Write the lower limit: _____.,10,,,,
Integer,4,The efficiency of solar cells is approximately 10-20%. Write the upper limit: _____.,20,,,,
Integer,5,The main constituent of biogas is methane (CH₄). Number of carbon atoms: _____.,1,,,,
Integer,6,The main constituent of biogas is methane (CH₄). Number of hydrogen atoms: _____.,4,,,,
Integer,7,In nuclear fission, the fuel used is Uranium-235. The atomic number of uranium is: _____.,92,,,,
Integer,8,The energy from 1 kg of uranium is equivalent to energy from approximately _____ million kg of coal (roughly 3 million, but for integer let's use a round number). Actually, it's about 2.7 million kg, so let's use 3.,3,,,,
Integer,9,The number of main fossil fuels is: _____ (coal, petroleum, natural gas - so 3).,3,,,,
Integer,10,The number of main renewable energy sources is approximately: _____ (solar, wind, hydro, tidal, geothermal, biomass - so 6).,6,,,,
Integer,11,1 kilowatt = _____ watts.,1000,,,,
Integer,12,1 megawatt = _____ kilowatts.,1000,,,,
Integer,13,The number of carbon atoms in methane (CH₄) is: _____.,1,,,,
Integer,14,The number of hydrogen atoms in methane (CH₄) is: _____.,4,,,,
Integer,15,The atomic number of carbon is: _____.,6,,,,
Integer,16,The atomic number of hydrogen is: _____.,1,,,,
Integer,17,The number of oxygen atoms in CO₂ is: _____.,2,,,,
Integer,18,The number of carbon atoms in CO₂ is: _____.,1,,,,
Integer,19,In the reaction CH₄ + 2O₂ → CO₂ + 2H₂O, the coefficient of O₂ is: _____.,2,,,,
Integer,20,In the reaction CH₄ + 2O₂ → CO₂ + 2H₂O, the coefficient of H₂O is: _____.,2,,,,
Integer,21,The number of hydrogen atoms in water (H₂O) is: _____.,2,,,,
Integer,22,The number of oxygen atoms in water (H₂O) is: _____.,1,,,,
Integer,23,1 calorie = approximately 4.2 joules. Write the coefficient: _____ (4).,4,,,,
Integer,24,The efficiency of wind turbines is approximately 30-40%. Write the lower limit: _____.,30,,,,
Integer,25,The efficiency of wind turbines is approximately 30-40%. Write the upper limit: _____.,40,,,,
Integer,26,The efficiency of hydroelectric power plants is approximately 80-90%. Write the lower limit: _____.,80,,,,
Integer,27,The efficiency of hydroelectric power plants is approximately 80-90%. Write the upper limit: _____.,90,,,,
Integer,28,The number of main types of solar cookers is: _____ (box type, panel type, parabolic - so 3).,3,,,,
Integer,29,The temperature in geothermal power plants can reach _____°C (typically 150-400°C, let's use 200 as a round number for integer type).,200,,,,
Integer,30,The number of main greenhouse gases is: _____ (CO₂, CH₄, N₂O, water vapor - so about 4 major ones).,4,,,,
Integer,31,1 ton = _____ kg.,1000,,,,
Integer,32,1 megaton = _____ tons.,1000000,,,,
Integer,33,The number of protons in uranium-235 is: _____ (atomic number 92).,92,,,,
Integer,34,The number of neutrons in uranium-235 is: _____ (235-92=143).,143,,,,
Integer,35,The percentage of methane in biogas is approximately 50-70%. Write the lower limit: _____.,50,,,,
Integer,36,The percentage of methane in biogas is approximately 50-70%. Write the upper limit: _____.,70,,,,
Integer,37,The number of carbon atoms in ethane (C₂H₆) is: _____.,2,,,,
Integer,38,The number of hydrogen atoms in ethane (C₂H₆) is: _____.,6,,,,
Integer,39,1 kilowatt-hour = _____ watt-hours.,1000,,,,
Integer,40,The number of oxygen atoms in O₂ is: _____.,2,,,,
Integer,41,In the reaction 2H₂ + O₂ → 2H₂O, the coefficient of H₂ is: _____.,2,,,,
Integer,42,In the reaction 2H₂ + O₂ → 2H₂O, the coefficient of O₂ is: _____.,1,,,,
Integer,43,In the reaction 2H₂ + O₂ → 2H₂O, the coefficient of H₂O is: _____.,2,,,,
Integer,44,The number of hydrogen atoms in hydrogen molecule (H₂) is: _____.,2,,,,
Integer,45,The efficiency of traditional biomass burning is approximately 10-20%. Write the lower limit: _____.,10,,,,
Integer,46,The efficiency of traditional biomass burning is approximately 10-20%. Write the upper limit: _____.,20,,,,
Integer,47,1 gigawatt = _____ megawatts.,1000,,,,
Integer,48,The number of main types of hydroelectric power plants is: _____ (dam-based, run-of-river, pumped storage - so 3).,3,,,,
Integer,49,The temperature difference required for ocean thermal energy conversion is at least _____°C (typically 20°C).,20,,,,
Integer,50,The number of carbon atoms in carbon dioxide (CO₂) is: _____.,1,,,,
Problem,1,What are the characteristics of a good source of energy?,"A good source of energy should have the following characteristics: 1) Should be easily available, 2) Should be cheap, 3) Should be easy to store and transport, 4) Should be able to do a large amount of work per unit mass, 5) Should be safe and convenient to use. Answer: Easily available, cheap, easy to store/transport, high work per unit mass, safe and convenient",,,,
Problem,2,What are fossil fuels? Give examples.,"Fossil fuels are fuels formed from the remains of dead plants and animals over millions of years under high pressure and temperature. Examples: 1) Coal - formed from dead plants, 2) Petroleum - formed from marine organisms, 3) Natural gas - formed from dead organisms. They are non-renewable sources of energy. Answer: Fuels from dead organisms over millions of years. Examples: Coal, Petroleum, Natural gas",,,,
Problem,3,What are the disadvantages of using fossil fuels?,"Disadvantages of fossil fuels: 1) They are non-renewable and will get exhausted, 2) They cause air pollution (CO₂, SO₂, NO₂), 3) They cause greenhouse effect and global warming, 4) They cause acid rain, 5) They are expensive, 6) They cause environmental degradation during extraction. Answer: Non-renewable, cause pollution, greenhouse effect, acid rain, expensive, environmental degradation",,,,
Problem,4,What is solar energy? How is it harnessed?,"Solar energy is the energy obtained from the sun in the form of light and heat. It is harnessed using: 1) Solar cells (photovoltaic cells) - convert sunlight directly into electricity, 2) Solar panels - collect and convert solar energy, 3) Solar cookers - use solar energy for cooking, 4) Solar water heaters - heat water using solar energy. Answer: Energy from sun. Harnessed using solar cells, solar panels, solar cookers, solar water heaters",,,,
Problem,5,What are the advantages and disadvantages of solar energy?,"Advantages: 1) Renewable and unlimited, 2) Clean and pollution-free, 3) Available everywhere, 4) Low maintenance cost. Disadvantages: 1) High initial cost, 2) Low efficiency (10-20%), 3) Not available during night, 4) Requires large area, 5) Weather dependent. Answer: Advantages: Renewable, clean, low maintenance. Disadvantages: High cost, low efficiency, not available at night",,,,
Problem,6,Explain how wind energy is harnessed.,"Wind energy is harnessed using wind turbines. When wind blows, it rotates the blades of the turbine, which rotates a generator to produce electricity. Wind farms are located in areas with high and constant wind speed (minimum 15 km/h). The kinetic energy of moving air is converted to electrical energy. Answer: Wind rotates turbine blades connected to generator, converts kinetic energy to electrical energy",,,,
Problem,7,What are the advantages and disadvantages of wind energy?,"Advantages: 1) Renewable and clean, 2) No pollution, 3) Low operating cost, 4) Can be used in remote areas. Disadvantages: 1) Requires high wind speed (minimum 15 km/h), 2) Not constant (depends on weather), 3) Requires large areas, 4) Can be noisy, 5) May affect bird migration. Answer: Advantages: Renewable, clean, low cost. Disadvantages: Needs high wind speed, not constant, requires large area",,,,
Problem,8,Explain how hydroelectric power is generated.,"Hydroelectric power is generated from the potential energy of water stored in dams. Water from a height flows down through pipes, rotating turbines. The turbines are connected to generators that produce electricity. The potential energy of water is converted to kinetic energy, which is then converted to electrical energy. Answer: Water from height flows through turbines connected to generators, converts potential to electrical energy",,,,
Problem,9,What are the advantages and disadvantages of hydroelectric power?,"Advantages: 1) Renewable and clean, 2) No pollution, 3) High efficiency (80-90%), 4) Low operating cost, 5) Can control water flow. Disadvantages: 1) Requires large dams, 2) Causes displacement of people, 3) Affects ecosystem, 4) High initial cost, 5) May cause flooding. Answer: Advantages: Renewable, clean, high efficiency. Disadvantages: Requires large dams, displacement, environmental impact",,,,
Problem,10,What is biomass energy? Give examples.,"Biomass energy is energy obtained from organic matter of plants and animals. Examples: 1) Wood and agricultural waste, 2) Animal dung, 3) Biogas (from decomposition), 4) Biofuels (ethanol, biodiesel). Biomass contains stored solar energy in the form of chemical energy. Answer: Energy from organic matter. Examples: Wood, animal dung, biogas, biofuels",,,,
Problem,11,What is biogas? How is it produced?,"Biogas is a mixture of gases (mainly methane) produced by the anaerobic decomposition of organic matter. It is produced from: 1) Animal dung, 2) Plant waste, 3) Agricultural waste, 4) Sewage. The organic matter is decomposed by bacteria in the absence of oxygen, producing biogas. Biogas contains 50-70% methane. Answer: Gas from decomposition of organic matter. Contains methane, produced from dung, plant waste",,,,
Problem,12,What is nuclear energy? How is it produced?,"Nuclear energy is energy obtained from the nucleus of atoms. It is produced by: 1) Nuclear fission - splitting of heavy nuclei (like Uranium-235) into smaller nuclei, releasing large amount of energy, 2) Nuclear fusion - combining of light nuclei (like hydrogen) to form heavier nuclei, releasing energy. Nuclear power plants use fission. Answer: Energy from atomic nuclei. Produced by fission (splitting) or fusion (combining) of nuclei",,,,
Problem,13,What are the advantages and disadvantages of nuclear energy?,"Advantages: 1) Large amount of energy from small amount of fuel, 2) No air pollution, 3) High efficiency. Disadvantages: 1) Produces radioactive waste (dangerous), 2) Risk of nuclear accidents, 3) High initial and decommissioning costs, 4) Requires strict safety measures, 5) Limited fuel supply (uranium). Answer: Advantages: Large energy output, no air pollution. Disadvantages: Radioactive waste, risk of accidents, expensive",,,,
Problem,14,What is tidal energy? How is it harnessed?,"Tidal energy is energy obtained from the rise and fall of tides in the ocean. It is harnessed by building dams across narrow openings to the sea. When tide comes in, water flows through turbines, generating electricity. When tide goes out, water flows back, again generating electricity. It uses the gravitational pull of the sun and moon. Answer: Energy from ocean tides. Harnessed by dams that capture water flow through turbines",,,,
Problem,15,What is geothermal energy? How is it harnessed?,"Geothermal energy is heat energy obtained from inside the Earth. The Earth's interior is hot (from radioactive decay), and this heat can be harnessed. It is harnessed by: 1) Drilling wells to access hot water/steam, 2) Using the steam to rotate turbines connected to generators. Areas near tectonic plate boundaries have high geothermal potential. Answer: Heat energy from inside Earth. Harnessed by drilling wells to access hot water/steam",,,,
Problem,16,What is ocean thermal energy?,"Ocean thermal energy is energy obtained from the temperature difference between warm surface water and cold deep water in oceans. The temperature difference (at least 20°C) is used to vaporize a working fluid, which drives turbines. This is called Ocean Thermal Energy Conversion (OTEC). Answer: Energy from temperature difference between surface and deep ocean water",,,,
Problem,17,What are renewable and non-renewable sources of energy? Give examples.,"Renewable sources: Sources that can be replenished naturally and are unlimited. Examples: Solar, Wind, Hydroelectric, Tidal, Geothermal, Biomass. Non-renewable sources: Sources that cannot be replenished and will get exhausted. Examples: Coal, Petroleum, Natural gas, Nuclear fuels. Answer: Renewable: Can be replenished (solar, wind, hydro). Non-renewable: Limited supply (coal, petroleum, natural gas)",,,,
Problem,18,What is the greenhouse effect?,"Greenhouse effect is the trapping of heat by certain gases in the atmosphere. Gases like CO₂, methane, water vapor act like a blanket, allowing sunlight to enter but trapping the heat radiated back from Earth. This causes global warming. Increased burning of fossil fuels increases CO₂, enhancing the greenhouse effect. Answer: Trapping of heat by gases (CO₂, methane) causing global warming",,,,
Problem,19,What is acid rain? What causes it?,"Acid rain is rain with high acidity (low pH). It is caused by pollutants like SO₂ and NO₂ released from burning fossil fuels. These gases react with water vapor in atmosphere to form acids (sulphuric acid and nitric acid), which fall as acid rain. Acid rain damages plants, buildings, and aquatic life. Answer: Rain with low pH caused by SO₂ and NO₂ from fossil fuels forming acids",,,,
Problem,20,Why should we use renewable sources of energy?,"We should use renewable sources because: 1) They are unlimited and won't get exhausted, 2) They are cleaner and cause less pollution, 3) They are sustainable for future generations, 4) They reduce dependence on fossil fuels, 5) They help combat climate change, 6) They can be used in remote areas. Answer: Unlimited, clean, sustainable, reduce pollution, help combat climate change",,,,
Problem,21,Compare conventional and non-conventional sources of energy.,"Conventional sources: Traditional sources used for long time (coal, petroleum, natural gas, hydroelectric). Non-conventional sources: New and alternative sources (solar, wind, tidal, geothermal, biomass). Conventional sources are mostly non-renewable (except hydro), while non-conventional are mostly renewable. Conventional cause more pollution than non-conventional. Answer: Conventional: Traditional (fossil fuels). Non-conventional: Alternative (solar, wind). Non-conventional are mostly renewable and cleaner",,,,
Problem,22,What is CNG? Why is it considered a cleaner fuel?,"CNG stands for Compressed Natural Gas. It is considered cleaner than petrol and diesel because: 1) It produces less harmful emissions, 2) It produces less CO₂ per unit energy, 3) It produces less pollutants (SO₂, NO₂, particulate matter), 4) It is more efficient, 5) It is safer (lighter than air, disperses quickly). Answer: Compressed Natural Gas. Cleaner because produces less emissions and pollutants",,,,
Problem,23,Explain the working of a solar cooker.,"Solar cookers work by: 1) Concentrating sunlight using reflectors, 2) Absorbing solar energy using a black surface, 3) Trapping heat using glass cover (greenhouse effect), 4) Cooking food using this trapped heat. Types: Box type, panel type, and parabolic type. They work best in sunny areas and can reach temperatures up to 100-150°C. Answer: Concentrates sunlight, black surface absorbs, glass traps heat, cooks food using solar energy",,,,
Problem,24,What is the difference between solar cells and solar panels?,"Solar cells (photovoltaic cells) are individual devices made of silicon that convert sunlight directly into electricity. Solar panels are collections of solar cells connected together to generate larger amounts of electricity. A solar panel contains many solar cells arranged in series or parallel. Answer: Solar cells are individual devices, solar panels are collections of many solar cells",,,,
Problem,25,Why is biomass considered a renewable source of energy?,"Biomass is considered renewable because: 1) It can be replenished continuously (plants grow, animals produce waste), 2) New biomass can be grown or produced, 3) The cycle can be repeated indefinitely, 4) It is derived from living or recently living organisms. However, it should be used sustainably to maintain the cycle. Answer: Can be replenished continuously, new biomass can be grown, cycle repeats indefinitely",,,,
Problem,26,What are the environmental impacts of using fossil fuels?,"Environmental impacts: 1) Air pollution (CO₂, SO₂, NO₂, particulate matter), 2) Greenhouse effect and global warming, 3) Acid rain, 4) Water pollution (oil spills), 5) Land degradation (mining), 6) Habitat destruction, 7) Health problems in humans and animals. Answer: Air pollution, global warming, acid rain, water/land pollution, health problems",,,,
Problem,27,Explain the principle of conservation of energy in the context of energy sources.,"The principle states that energy cannot be created or destroyed, only converted from one form to another. For example: In solar cells, light energy converts to electrical energy. In wind turbines, kinetic energy converts to electrical energy. In hydroelectric plants, potential energy converts to kinetic then electrical. Total energy is conserved. Answer: Energy cannot be created/destroyed, only converted from one form to another",,,,
Problem,28,What is the efficiency of energy conversion?,"Efficiency of energy conversion is the ratio of useful energy output to total energy input, expressed as percentage. Example: If a solar cell converts 15% of solar energy to electrical energy, its efficiency is 15%. Higher efficiency means less energy is wasted. Different sources have different efficiencies. Answer: Ratio of useful output to input energy, expressed as percentage",,,,
Problem,29,Why is it important to improve the efficiency of energy conversion?,"Improving efficiency is important because: 1) Reduces energy waste, 2) Saves resources (less fuel needed), 3) Reduces cost, 4) Reduces environmental impact, 5) Makes better use of available energy sources, 6) Sustainable use of resources. Higher efficiency means more work done with same input. Answer: Reduces waste, saves resources, reduces cost and environmental impact",,,,
Problem,30,What is the role of energy in our daily life?,"Energy is essential for: 1) Cooking food, 2) Transportation, 3) Electricity for homes and industries, 4) Manufacturing, 5) Agriculture, 6) Communication, 7) Heating and cooling, 8) All modern conveniences. Without energy, modern life would not be possible. Energy is the capacity to do work. Answer: Essential for cooking, transportation, electricity, manufacturing, all daily activities",,,,
Problem,31,What are the challenges in using renewable energy sources?,"Challenges: 1) High initial cost, 2) Intermittent availability (solar not at night, wind not always blowing), 3) Storage problems (batteries expensive), 4) Requires large areas, 5) Low efficiency in some cases, 6) Weather dependent, 7) Infrastructure requirements, 8) Technical limitations. Answer: High cost, intermittent availability, storage problems, large areas needed, weather dependent",,,,
Problem,32,Explain the concept of energy crisis.,"Energy crisis refers to the shortage of energy sources to meet demand. It occurs when: 1) Fossil fuels get depleted, 2) Demand exceeds supply, 3) Prices rise too high, 4) Sources become unavailable. To overcome: Use renewable sources, improve efficiency, conserve energy, develop new technologies. Answer: Shortage of energy sources when demand exceeds supply, can be overcome by using renewables and conservation",,,,
