Question_Type,Question_Number,Question,Option_A,Option_B,Option_C,Option_D,Answer
Problem,33,What is energy conservation? Why is it important?,"Energy conservation means using energy efficiently and avoiding wastage. It is important because: 1) Saves resources, 2) Reduces cost, 3) Reduces pollution, 4) Makes energy last longer, 5) Reduces environmental impact, 6) Sustainable for future. Methods: Use energy-efficient devices, turn off when not needed, reduce consumption. Answer: Using energy efficiently, avoiding waste. Important to save resources, reduce cost and pollution",,,,
Problem,34,Compare the energy output from 1 kg of different fuels.,"Approximate energy output: 1 kg of uranium-235 ≈ 2.7 million kg of coal, 1 kg of coal ≈ 30 MJ, 1 kg of petrol ≈ 45 MJ, 1 kg of natural gas ≈ 55 MJ, 1 kg of biomass ≈ 15-20 MJ. Nuclear fuel has highest energy density. Answer: Nuclear fuel (uranium) has highest energy output, then natural gas, petrol, coal, biomass",,,,
Problem,35,What is the difference between energy and power?,"Energy is the capacity to do work, measured in Joules (J) or kilowatt-hours (kWh). Power is the rate of doing work or rate of energy consumption, measured in Watts (W) or kilowatts (kW). Power = Energy / Time. Example: A 100W bulb uses 100 Joules per second. Answer: Energy is capacity to do work (Joules), Power is rate of doing work (Watts = Joules/second)",,,,
Problem,36,Explain why some areas are more suitable for certain renewable energy sources.,"Some areas are more suitable because: 1) Solar - areas with high sunlight (deserts, tropical regions), 2) Wind - coastal areas, hilltops with high wind speed, 3) Hydroelectric - hilly areas with rivers and water flow, 4) Geothermal - areas near tectonic plate boundaries, 5) Tidal - coastal areas with large tides. Geographic and climatic conditions determine suitability. Answer: Geographic and climatic conditions determine suitability (solar in sunny areas, wind in windy areas, etc.)",,,,
Problem,37,What is the future of energy sources?,"Future trends: 1) Shift towards renewable sources, 2) Development of better storage technologies, 3) Improvement in efficiency, 4) Hybrid systems (combining multiple sources), 5) Smart grids, 6) Development of new technologies (fuel cells, hydrogen energy), 7) Energy conservation, 8) Sustainable practices. Answer: Shift to renewables, better storage, improved efficiency, new technologies, sustainable practices",,,,
Problem,38,What are the advantages of using multiple energy sources?,"Advantages: 1) Reliability (if one fails, others available), 2) Optimal use of resources, 3) Can use best source for specific purpose, 4) Reduces dependence on single source, 5) Better energy security, 6) Can balance intermittent sources, 7) More sustainable. Answer: Reliability, optimal resource use, reduces dependence, better energy security, more sustainable",,,,
Problem,39,Explain the working of a biogas plant.,"Biogas plant works by: 1) Feeding organic waste (dung, plant waste) into a digester, 2) Anaerobic bacteria decompose the waste in absence of oxygen, 3) This produces biogas (mainly methane), 4) Biogas is collected and used as fuel, 5) Leftover slurry is used as fertilizer. The process takes 2-4 weeks. Answer: Organic waste decomposed by bacteria without oxygen, produces methane gas, leftover used as fertilizer",,,,
Problem,40,What is the difference between thermal power plant and hydroelectric power plant?,"Thermal power plant: Burns fossil fuels (coal, gas) to heat water, produce steam, rotate turbines, generate electricity. Causes pollution. Hydroelectric plant: Uses falling water from height to rotate turbines, generate electricity. Clean and renewable. Thermal uses chemical energy, hydro uses potential energy. Answer: Thermal burns fuels (polluting), Hydro uses falling water (clean, renewable)",,,,
Problem,41,Why is solar energy not widely used despite being abundant?,"Reasons: 1) High initial cost of installation, 2) Low efficiency (10-20%), 3) Intermittent (not available at night), 4) Requires large area, 5) Storage batteries are expensive, 6) Weather dependent, 7) Infrastructure and maintenance costs. However, costs are decreasing, making it more viable. Answer: High initial cost, low efficiency, intermittent availability, storage problems, weather dependent",,,,
Problem,42,What are the social and economic impacts of energy sources?,"Social impacts: 1) Employment opportunities, 2) Development and modernization, 3) Health issues from pollution, 4) Displacement (dams, mining). Economic impacts: 1) Cost of energy affects economy, 2) Energy security important, 3) Investment in infrastructure, 4) Price fluctuations, 5) Trade balances. Answer: Social: Employment, development, health issues. Economic: Costs, security, investments, price fluctuations",,,,
Problem,43,Explain the importance of energy for economic development.,"Energy is crucial for economic development because: 1) Powers industries and manufacturing, 2) Enables transportation and trade, 3) Supports agriculture and food production, 4) Enables technology and innovation, 5) Creates employment, 6) Improves standard of living, 7) Essential for all economic activities. Without energy, economy cannot function. Answer: Powers industries, enables transportation, supports agriculture, creates employment, essential for all economic activities",,,,
Problem,44,What is the role of government in energy management?,"Government role: 1) Formulating energy policies, 2) Promoting renewable energy, 3) Setting standards and regulations, 4) Providing subsidies and incentives, 5) Building infrastructure, 6) Ensuring energy security, 7) Research and development, 8) Conservation programs, 9) Environmental protection. Answer: Policies, promote renewables, regulations, subsidies, infrastructure, research, conservation",,,,
Problem,45,What are biofuels? Give examples.,"Biofuels are fuels derived from biomass (living or recently living organisms). Examples: 1) Ethanol - from sugarcane, corn, 2) Biodiesel - from vegetable oils, animal fats, 3) Biogas - from organic waste, 4) Wood and charcoal. They are renewable and can replace fossil fuels. Answer: Fuels from biomass. Examples: Ethanol, biodiesel, biogas, wood",,,,
Problem,46,Compare the advantages of renewable and non-renewable energy sources.,"Renewable advantages: Unlimited, clean, sustainable, low pollution, available locally. Non-renewable advantages: High energy density, well-established technology, reliable supply (currently), can be stored easily, high efficiency. However, renewables are better for long-term sustainability. Answer: Renewable: Unlimited, clean. Non-renewable: High energy density, established technology, but limited supply",,,,
Problem,47,What is energy security?,"Energy security means having reliable, affordable, and sustainable access to energy sources. It involves: 1) Adequate supply of energy, 2) Diverse energy sources, 3) Stable prices, 4) Infrastructure, 5) Independence from external suppliers, 6) Ability to meet demand. Important for national development and stability. Answer: Reliable, affordable, sustainable access to energy, involves adequate supply, diverse sources, stable prices",,,,
Problem,48,Explain the concept of sustainable development in energy.,"Sustainable development in energy means meeting present energy needs without compromising future generations' ability to meet their needs. It involves: 1) Using renewable sources, 2) Conserving energy, 3) Improving efficiency, 4) Reducing pollution, 5) Protecting environment, 6) Long-term planning. Balance between development and environmental protection. Answer: Meeting present needs without compromising future, involves renewables, conservation, efficiency, environmental protection",,,,
Problem,49,What are the steps we can take to conserve energy in daily life?,"Steps: 1) Use energy-efficient appliances (LED bulbs, 5-star rated), 2) Turn off lights/fans when not needed, 3) Use public transport, 4) Reduce, reuse, recycle, 5) Use solar water heaters, 6) Insulate buildings, 7) Walk or cycle short distances, 8) Use natural light, 9) Unplug devices when not in use. Answer: Efficient appliances, turn off when not needed, use public transport, reduce/reuse/recycle, use renewables",,,,
Problem,50,What is the importance of research and development in energy sector?,"R&D is important for: 1) Developing new energy sources, 2) Improving efficiency, 3) Reducing costs, 4) Better storage technologies, 5) Solving technical challenges, 6) Innovation, 7) Making renewable energy more viable, 8) Energy conservation methods, 9) Environmental solutions. R&D drives progress in energy sector. Answer: Develop new sources, improve efficiency, reduce costs, better storage, innovation, solve technical challenges",,,,

