Question_Type,Question_Number,Question,Option_A,Option_B,Option_C,Option_D,Answer
MCQ,1,Who wrote the letter received by Miss Mason?,Wanda,Wanda's mother,Wanda's father,The principal,Wanda's father
MCQ,2,What did the letter from Wanda's father say?,Wanda was sick,Wanda won't be coming to school anymore,They were moving to a big city,Both B and C,Both B and C
MCQ,3,What else did the letter mention about Wanda?,Her funny name,Her drawings,Her medal,Her dress,Her funny name
MCQ,4,How did the class react to Miss Mason reading the letter?,They laughed,They were silent,They were happy,They clapped,They were silent
MCQ,5,Who felt the most guilty after reading the letter?,Peggy,Maddie,Miss Mason,The whole class,Maddie
MCQ,6,What did Maddie decide to do after reading the letter?,Apologize to Wanda,Ignore the situation,Blame Peggy,Leave the school,Apologize to Wanda
MCQ,7,Where did Maddie and Peggy go to find Wanda?,Boggins Heights,City center,The school,The park,Boggins Heights
MCQ,8,What did they find at Wanda's house?,It was empty,It was full of people,It was on fire,It was locked,It was empty
MCQ,9,What did Maddie and Peggy write to Wanda?,A letter of apology,A letter of complaint,A letter asking for drawings,A friendly letter asking about her,A friendly letter asking about her
MCQ,10,Did Wanda reply to their letter?,Yes immediately,No never,Yes after a long time,Yes the next day,Yes after a long time
MCQ,11,What did Wanda's reply include?,A drawing for each girl,A letter,A gift,Both A and B,Both A and B
MCQ,12,Who was more anxious for a reply?,Peggy,Maddie,Miss Mason,The class,Maddie
MCQ,13,What did Wanda's letter reveal?,She hated them,She forgave them,She was angry,She was indifferent,She forgave them
MCQ,14,What did Wanda give to Maddie and Peggy?,Her drawings,Her dresses,Her books,Her shoes,Her drawings
MCQ,15,What was special about the drawings Wanda gave?,They were blank,They had their faces on them,They were torn,They were unfinished,They had their faces on them
MCQ,16,How did Maddie feel after receiving the drawing?,Happy,Guilty and sad,Angry,Indifferent,Guilty and sad
MCQ,17,What did Peggy realize about Wanda?,She was dumb,She was smart and talented,She was indifferent,She was angry,She was smart and talented
MCQ,18,What lesson did Maddie learn?,To be silent,To stand up against bullying,To ignore others,To be indifferent,To stand up against bullying
MCQ,19,What did the class do after reading Wanda's letter?,Ignored it,Laughed,Reflected on their behavior,Celebrated,Reflected on their behavior
MCQ,20,What did Maddie vow to do in the future?,Be silent,Stand up against bullying,Ignore others,Be indifferent,Stand up against bullying
MCQ,21,What did Wanda's father mention in his letter?,They were moving to a big city,They were happy,They were sad,They were staying,They were moving to a big city
MCQ,22,Why did Wanda's family move to the city?,They were rich,They were poor,They were being teased,They were happy,They were being teased
MCQ,23,What did Maddie and Peggy realize about Wanda's drawings?,They were ugly,They were beautiful,They were incomplete,They were stolen,They were beautiful
MCQ,24,What did the drawings symbolize?,Wanda's anger,Wanda's forgiveness,Wanda's indifference,Wanda's sadness,Wanda's forgiveness
MCQ,25,What did Maddie and Peggy feel after receiving the drawings?,Happy,Guilty,Angry,Indifferent,Guilty
MCQ,26,What did the class learn from Wanda's departure?,Nothing,To be kind,To be indifferent,To be silent,To be kind
MCQ,27,What did Maddie decide to do if she saw someone being bullied?,Ignore it,Join in,Stand up against it,Be silent,Stand up against it
MCQ,28,What did Peggy think about Wanda's drawings?,They were ugly,They were beautiful,They were incomplete,They were stolen,They were beautiful
MCQ,29,What did Wanda's letter show about her character?,She was angry,She was forgiving,She was indifferent,She was sad,She was forgiving
MCQ,30,What did Maddie dream about at night?,Pleasant dreams,She had sleepless nights,Dreams about Wanda being bullied,Dreams about school,Dreams about Wanda being bullied
MCQ,31,What did Maddie feel in her stomach after hearing the letter?,Happiness,A sick feeling,Anger,Excitement,A sick feeling
MCQ,32,What did Miss Mason do after reading the letter?,She scolded the class,She was upset,She ignored it,She laughed,She was upset
MCQ,33,What was Wanda's drawing for Peggy?,A blue dress,A green dress with red trimmings,A red dress,A yellow dress,A green dress with red trimmings
MCQ,34,What was Wanda's drawing for Maddie?,A blue dress,A green dress,A red dress,A yellow dress,A blue dress
MCQ,35,What did Wanda wish in her letter?,Happy New Year,Merry Christmas,Happy Birthday,Good luck,Merry Christmas
MCQ,36,How long did it take for Wanda's reply to arrive?,One week,Two weeks,Weeks,Weeks and weeks,Weeks and weeks
MCQ,37,What did the letter reveal about why Wanda's family moved?,Because of the big city,Because of her funny name,Because they were teased,Because they were rich,Because of her funny name
MCQ,38,What did Maddie think about her silence during the teasing?,It was fine,It was wrong,It didn't matter,It was helpful,It was wrong
MCQ,39,What was the main theme of Part II?,Forgiveness,Bullying,Guilt,All of the above,All of the above
MCQ,40,How did Peggy feel when she saw Wanda's drawings?,Guilty,Happy,Angry,Indifferent,Guilty
MCQ,41,What did the drawings teach Maddie and Peggy?,Wanda was talented,Wanda had forgiven them,Wanda remembered them,All of the above,All of the above
MCQ,42,What did Maddie realize about her behavior?,It was fine,It was wrong,It didn't matter,It was helpful,It was wrong
MCQ,43,What was the significance of Wanda including their faces in the drawings?,She hated them,She remembered and forgave them,She forgot them,She was angry,She remembered and forgave them
MCQ,44,What did Maddie promise herself?,To never speak,To never let anyone be bullied,To ignore others,To be popular,To never let anyone be bullied
MCQ,45,How did the story end?,Happily,Sadly,With a lesson learned,With guilt,With a lesson learned
MCQ,46,What emotion did Maddie experience most strongly?,Happiness,Guilt,Anger,Excitement,Guilt
MCQ,47,What did Wanda's generosity show?,She was rich,She was forgiving,She was angry,She was sad,She was forgiving
MCQ,48,What was Miss Mason's reaction to the letter?,She was happy,She was upset,She was angry,She was indifferent,She was upset
MCQ,49,What did the class realize after Wanda left?,Nothing,They should be kind,They did nothing wrong,They were right,They should be kind
MCQ,50,What is the moral lesson of Part II?,Stand up against bullying,Forgiveness is important,Guilt can teach lessons,All of the above,All of the above
Fill_Blank,1,Mr. Petronski wrote a letter to Miss Mason stating that his daughter Wanda would not be attending school anymore because they were moving to a ______ city.,big,large,major,huge,big
Fill_Blank,2,Miss Mason was ______ and upset after reading Mr. Petronski's letter.,unhappy,sad,distressed,concerned,unhappy
Fill_Blank,3,Maddie felt a sick feeling in the bottom of her ______ after hearing the letter.,stomach,gut,belly,abdomen,stomach
Fill_Blank,4,Maddie and Peggy decided to visit Wanda's house at ______ Heights.,Boggins,Boggin's,Boggins',Boggins Heights,Boggins
Fill_Blank,5,When they reached Wanda's house, they found it was ______.,empty,vacant,deserted,abandoned,empty
Fill_Blank,6,Maddie and Peggy wrote a ______ letter to Wanda.,friendly,kind,polite,nice,friendly
Fill_Blank,7,In the letter, they told Wanda that she had won the ______ contest.,drawing,art,design,painting,drawing
Fill_Blank,8,They asked Wanda if she liked her new ______ and teacher.,place,school,home,location,place
Fill_Blank,9,They signed the letter with lots of ______ for love.,X's,Xs,kisses,hugs,X's
Fill_Blank,10,Weeks went by, and they did not receive a ______ from Wanda.,reply,response,answer,letter,reply
Fill_Blank,11,Maddie was more ______ for a reply than Peggy.,anxious,worried,eager,concerned,anxious
Fill_Blank,12,Maddie used to have sleepless nights and saw frightful ______ about Wanda.,dreams,nightmares,visions,thoughts,dreams
Fill_Blank,13,Finally, a letter from Wanda was received by the ______.,school,teacher,class,principal,school
Fill_Blank,14,In her letter, Wanda wished her teacher and all the girls a Merry ______.,Christmas,Xmas,Holiday,New Year,Christmas
Fill_Blank,15,Wanda requested Miss Mason to give two of her drawings to Maddie and ______.,Peggy,Margaret,Peg,Petra,Peggy
Fill_Blank,16,The drawing given to Peggy was of a green dress with red ______.,trimmings,trim,decorations,details,trimmings
Fill_Blank,17,The drawing given to Maddie was of a blue ______.,dress,gown,frock,outfit,dress
Fill_Blank,18,Maddie and Peggy were surprised because the drawings had their ______ on them.,faces,likeness,portraits,images,faces
Fill_Blank,19,This showed that Wanda had ______ them even though they had teased her.,forgiven,pardoned,excused,accepted,forgiven
Fill_Blank,20,Maddie felt ______ after receiving the drawing.,guilty,sad,happy,angry,guilty
Fill_Blank,21,Wanda's family moved because they were being ______.,teased,bullied,harassed,taunted,teased
Fill_Blank,22,Maddie vowed never to let anyone be ______ again.,bullied,teased,harassed,taunted,bullied
Fill_Blank,23,The letter mentioned Wanda's funny ______.,name,last name,surname,family name,name
Fill_Blank,24,Maddie and Peggy went to Boggins Heights to find ______.,Wanda,the Petronskis,the house,Wanda's family,Wanda
Fill_Blank,25,When they found the house empty, they felt ______.,disappointed,sad,guilty,worried,disappointed
Fill_Blank,26,They wrote the letter to Wanda's ______ address.,new,old,previous,current,new
Fill_Blank,27,Wanda's reply came after ______ and weeks.,weeks,days,months,time,weeks
Fill_Blank,28,Maddie was more ______ than Peggy about getting a reply.,anxious,worried,eager,concerned,anxious
Fill_Blank,29,The drawings showed that Wanda had ______ the girls.,remembered,forgotten,forgiven,hated,remembered
Fill_Blank,30,Peggy realized that Wanda was ______ and talented.,smart,intelligent,clever,brilliant,smart
Fill_Blank,31,The class learned the importance of being ______ to others.,kind,nice,good,polite,kind
Fill_Blank,32,Maddie learned the lesson of standing up against ______.,bullying,teasing,harassment,taunting,bullying
Fill_Blank,33,Wanda's ______ was evident in her letter and drawings.,forgiveness,generosity,kindness,goodness,forgiveness
Fill_Blank,34,The story teaches the importance of ______.,empathy,kindness,forgiveness,All of the above,All of the above
Fill_Blank,35,Maddie felt ______ in her stomach after hearing the letter.,sick,unwell,queasy,nauseous,sick
Fill_Blank,36,The class was ______ after Miss Mason read the letter.,silent,quiet,still,calm,silent
Fill_Blank,37,Wanda's drawings were ______ and beautiful.,talented,skilled,well-done,artistic,beautiful
Fill_Blank,38,Maddie promised to never let anyone be ______.,bullied,teased,harassed,taunted,bullied
Fill_Blank,39,The drawings had the girls' ______ on them.,faces,likeness,portraits,images,faces
Fill_Blank,40,Wanda wished everyone a Merry ______.,Christmas,Xmas,Holiday,New Year,Christmas
Fill_Blank,41,Miss Mason was ______ about the situation.,upset,unhappy,sad,concerned,upset
Fill_Blank,42,Maddie had ______ nights thinking about Wanda.,sleepless,restless,troubled,worried,sleepless
Fill_Blank,43,Wanda's letter showed her ______ nature.,forgiving,kind,generous,good,forgiving
Fill_Blank,44,The story ends with a valuable ______ learned.,lesson,moral,teaching,insight,lesson
Fill_Blank,45,Maddie and Peggy wrote a ______ letter to Wanda.,friendly,kind,polite,nice,friendly
Fill_Blank,46,They told Wanda she had won the ______ contest.,drawing,art,design,painting,drawing
Fill_Blank,47,Wanda's reply came to the ______.,school,teacher,class,principal,school
Fill_Blank,48,The drawings were a gift of ______.,forgiveness,kindness,generosity,goodwill,forgiveness
Fill_Blank,49,Maddie learned to stand up against ______.,bullying,teasing,harassment,taunting,bullying
Fill_Blank,50,The story emphasizes the power of ______.,forgiveness,kindness,empathy,All of the above,All of the above
Descriptive,1,Describe the letter received by Miss Mason and its contents.,The letter was from Mr. Petronski, Wanda's father, informing Miss Mason that Wanda would not be coming to school anymore because they were moving to a big city. The letter also mentioned that in the big city, no one would ask about Wanda's funny name. The letter was brief and formal, conveying the family's decision to move. When Miss Mason read the letter to the class, everyone was silent, and many students, especially Maddie, felt guilty about how they had treated Wanda.,,,
Descriptive,2,How did Maddie react after hearing the letter from Wanda's father?,"Maddie felt a sick feeling in the bottom of her stomach. She was deeply troubled and felt guilty about not standing up for Wanda when Peggy and others teased her. She realized that her silence had been as harmful as the teasing itself. Maddie wanted to apologize to Wanda and make things right. She felt responsible for Wanda's departure and vowed never to let anyone be bullied again.",,,
Descriptive,3,Describe what happened when Maddie and Peggy went to visit Wanda at Boggins Heights.,Maddie and Peggy decided to visit Wanda's house at Boggins Heights to apologize and make amends. However, when they reached the house, they found it empty. The Petronski family had already moved away. The empty house made them realize that Wanda was really gone, and they would not get a chance to apologize in person. This discovery added to their feelings of guilt and regret.,,,
Descriptive,4,What did Maddie and Peggy write in their letter to Wanda?,"Maddie and Peggy wrote a friendly letter to Wanda at her new address. They told her that she had won the drawing contest and that her drawings were very beautiful. They asked her if she liked her new place and teacher. They signed the letter with lots of X's for love, showing their attempt to make amends and reconnect with Wanda. However, weeks went by without a reply.",,,
Descriptive,5,Describe Maddie's anxiety while waiting for Wanda's reply.,Maddie was more anxious than Peggy about receiving a reply from Wanda. She used to have sleepless nights and saw frightful dreams about Wanda being bullied. She couldn't stop thinking about how she had remained silent when Wanda was being teased. Her guilt consumed her, and she desperately wanted to know if Wanda had forgiven them. The wait for the reply was emotionally draining for Maddie.,,,
Descriptive,6,What did Wanda's reply letter contain?,"Finally, after weeks and weeks, a letter from Wanda arrived at the school. In her letter, Wanda wished her teacher and all the girls a Merry Christmas. She mentioned that she missed everyone and that she was doing well in her new school. Most importantly, she asked Miss Mason to give two of her drawings - one to Peggy and one to Maddie. The letter showed Wanda's forgiving nature and her ability to remember her classmates fondly despite how they had treated her.,,,
Descriptive,7,Describe the drawings Wanda sent for Maddie and Peggy.,Wanda sent two drawings - one for Peggy showing a green dress with red trimmings, and one for Maddie showing a blue dress. The most remarkable thing about these drawings was that they had the faces of Peggy and Maddie on them, respectively. This showed that Wanda had been drawing the girls all along and had included their faces in her designs. The drawings were beautiful and demonstrated Wanda's artistic talent and her ability to remember and include her classmates in her work.,,,
Descriptive,8,What was the significance of the faces in Wanda's drawings?,"The fact that Wanda had included their faces in the drawings was significant because it showed several things: first, that Wanda had remembered them and thought about them; second, that she had been drawing them even while they were teasing her; third, and most importantly, that she had forgiven them. The drawings were a gift of forgiveness, showing Wanda's generous and forgiving spirit despite the way she had been treated.",,,
Descriptive,9,How did Maddie and Peggy feel after receiving the drawings?,"After receiving the drawings, both Maddie and Peggy felt guilty and sad. They realized how talented and kind Wanda was, and they felt remorse for having teased her. Maddie, in particular, was deeply affected. She hung the drawing on the wall but couldn't enjoy looking at it because of her guilt. The drawings reminded them of their wrongdoing and the pain they had caused Wanda, but also showed them Wanda's capacity for forgiveness.,,,
Descriptive,10,What lesson did Maddie learn from the whole experience?,"Maddie learned a crucial lesson about the importance of standing up against bullying. She realized that her silence had been wrong and that by not speaking up when Wanda was being teased, she was as guilty as those who were actively teasing. She vowed never to let anyone be bullied again and promised herself that she would always stand up for those who were being mistreated, even if it meant losing her own popularity or friendship with others.,,,
Descriptive,11,Explain the theme of forgiveness in "The Hundred Dresses - II".,"The theme of forgiveness is central to Part II. Despite being teased and bullied, Wanda demonstrates remarkable forgiveness by sending beautiful drawings to the very girls who had teased her. Her letter is friendly and kind, showing no anger or resentment. The drawings with their faces on them symbolize Wanda's forgiveness and her ability to see past the hurtful behavior to remember her classmates fondly. This theme teaches readers about the power of forgiveness and the importance of letting go of grudges.",,,
Descriptive,12,How does the story address the issue of guilt and redemption?,"The story addresses guilt through Maddie's character, who feels deeply guilty about not standing up for Wanda. Her sleepless nights and anxious waiting for Wanda's reply show how guilt can consume a person. However, Wanda's forgiveness provides a form of redemption. While Maddie can't change the past, she learns from her mistakes and vows to do better in the future. The story shows that while we can't undo our wrongs, we can learn from them and commit to better behavior.,,,
Descriptive,13,What does the empty house at Boggins Heights symbolize?,"The empty house at Boggins Heights symbolizes the finality of Wanda's departure and the missed opportunity for Maddie and Peggy to make amends in person. It represents the consequences of their actions - Wanda is gone, and they cannot change what happened. The emptiness also reflects the emotional void left by Wanda's absence and serves as a visual reminder of the impact of bullying and exclusion.,,,
Descriptive,14,Compare and contrast Maddie's and Peggy's reactions to the situation.,"Maddie feels much more guilty and anxious than Peggy. She has sleepless nights and is more desperate for a reply from Wanda. Peggy, while also feeling guilty, doesn't seem to be as deeply affected. Maddie realizes that her silence was wrong and vows to stand up against bullying in the future. Both girls feel remorseful, but Maddie's reaction is more intense and transformative, showing her greater awareness of her complicity in Wanda's mistreatment.,,,
Descriptive,15,What role does Miss Mason play in Part II of the story?,"Miss Mason plays a crucial role as the teacher who receives and reads Mr. Petronski's letter to the class. She is upset about the situation, showing her care for her students. She also receives Wanda's reply and distributes the drawings to Maddie and Peggy as requested. While she doesn't directly lecture the students, her presence and the way she handles the situation help facilitate the students' reflection on their behavior. She serves as a moral guide in the story.,,,
Descriptive,16,How does the story show the consequences of bullying?,"The story shows the consequences of bullying in several ways: Wanda's family is forced to move because of the teasing, the class loses a talented and kind classmate, and the bullies (particularly Maddie) experience deep guilt and regret. The story demonstrates that bullying doesn't just affect the victim but also has lasting consequences for those who participate or remain silent. The emotional impact on Maddie shows how guilt can be a powerful consequence of wrongdoing.,,,
Descriptive,17,What does Wanda's letter reveal about her character?,"Wanda's letter reveals her to be a forgiving, generous, and kind-hearted person. Despite being teased and bullied, she holds no grudge against her classmates. She wishes them well, remembers them fondly, and even sends them gifts (the drawings). Her letter shows maturity and grace beyond her years. She chooses forgiveness over anger, showing that she has moved on and doesn't let the past define her relationships. Her character exemplifies resilience and kindness.,,,
Descriptive,18,Explain the significance of the title "The Hundred Dresses - II".,"The title 'The Hundred Dresses - II' indicates this is the continuation of Part I. In Part II, the focus shifts from Wanda's claim about having a hundred dresses to the aftermath of her departure. While Part I deals with the teasing and the drawing contest, Part II deals with the consequences, guilt, forgiveness, and the lessons learned. The title maintains continuity while indicating that this part will resolve or continue the themes introduced in Part I.,,,
Descriptive,19,How does the story demonstrate the power of art?,The story demonstrates the power of art through Wanda's drawings, which serve multiple purposes: they win the contest, showcase her talent, become a gift of forgiveness, and communicate her feelings without words. The drawings with the girls' faces on them are particularly powerful because they show that Wanda had been thinking about her classmates and including them in her art. Art becomes a medium for connection, forgiveness, and expression in the story.,,,
Descriptive,20,What is the overall message of "The Hundred Dresses - II"?,The overall message is about the importance of standing up against bullying, the power of forgiveness, and the lasting impact of our actions. The story teaches that silence in the face of injustice is as wrong as active participation in bullying. It emphasizes that it's never too late to recognize our mistakes and commit to doing better. Wanda's forgiveness shows that kindness can overcome cruelty, and Maddie's transformation shows that people can learn and grow from their mistakes.,,,
Descriptive,21,Describe the emotional journey of Maddie throughout Part II.,"Maddie's emotional journey begins with guilt and a 'sick feeling' after hearing the letter. She decides to apologize, but finding the empty house adds to her regret. Writing the letter and waiting for a reply creates anxiety and sleepless nights. When Wanda's reply finally comes with the drawings, Maddie feels both touched by Wanda's forgiveness and guilty about her past behavior. The journey ends with Maddie learning a valuable lesson and vowing to stand up against bullying in the future, showing growth and transformation.",,,
Descriptive,22,How does the story address the theme of empathy?,"The story addresses empathy primarily through Maddie's character development. Initially, Maddie doesn't fully empathize with Wanda's situation, but after Wanda leaves, she begins to understand how Wanda must have felt. Her guilt and anxiety show that she is developing empathy. Wanda's letter and drawings also teach empathy by showing the girls how their actions affected her. The story encourages readers to put themselves in others' shoes and understand the impact of their behavior on others.,,,
Descriptive,23,What does the delay in Wanda's reply suggest?,"The delay in Wanda's reply (weeks and weeks) suggests several things: first, that Wanda and her family were settling into their new life in the big city; second, that Wanda may have needed time to process everything; and third, it adds to the tension and anxiety that Maddie experiences, making the eventual reply more meaningful. The delay also emphasizes the distance (both physical and emotional) that had grown between Wanda and her former classmates.,,,
Descriptive,24,How does the story show the importance of taking responsibility for one's actions?,"The story shows the importance of taking responsibility through Maddie's character. While she didn't actively tease Wanda, she recognizes that her silence was wrong and takes responsibility for it. She doesn't make excuses or blame others; instead, she acknowledges her mistake, feels genuine remorse, and commits to doing better in the future. This demonstrates that taking responsibility is the first step toward growth and positive change.,,,
Descriptive,25,What makes Wanda's forgiveness particularly meaningful?,"Wanda's forgiveness is particularly meaningful because it comes without any apology or request from Maddie and Peggy. She forgives them proactively, showing generosity of spirit. The fact that she includes their faces in the drawings shows that she had been thinking about them and had already forgiven them. Her forgiveness is not conditional or grudging - it's genuine and complete. This makes it a powerful example of unconditional forgiveness and grace.,,,
