Question_Type,Question_Number,Question,Option_A,Option_B,Option_C,Option_D,Answer
Descriptive,26,How does the setting contribute to the story's themes?,"The setting contributes in several ways: Boggins Heights represents Wanda's isolation and poverty, making her an easy target for teasing. The empty house symbolizes finality and missed opportunities. The school setting where the letter is read creates a space for collective reflection. The new city where Wanda moves represents a fresh start, free from the bullying she experienced. Each setting serves to reinforce the story's themes of social class, isolation, consequences, and new beginnings.,,,
Descriptive,27,What does the story teach about peer pressure?,"The story teaches about peer pressure through Maddie's experience. Maddie felt pressured to remain silent when Wanda was being teased because she didn't want to lose Peggy's friendship or become a target herself. However, the story shows that giving in to peer pressure and remaining silent in the face of injustice is wrong. Maddie learns that it's better to stand up for what's right, even if it means going against the group or risking one's own popularity.,,,
Descriptive,28,How does Wanda's character challenge stereotypes?,"Wanda challenges stereotypes in several ways: despite being poor and wearing the same dress every day, she proves to be incredibly talented and creative. Despite being teased and bullied, she responds with forgiveness rather than bitterness. Despite being seen as different or 'other,' she shows that she is thoughtful, kind, and remembers her classmates. She challenges the stereotype that poor or 'different' people are less worthy or less capable than others.,,,
Descriptive,29,What is the significance of Wanda mentioning her 'funny name' in the letter?,"Wanda's father mentioning her 'funny name' in the letter is significant because it shows that the family was aware of the teasing and that it was one of the reasons they decided to move. It highlights how seemingly 'harmless' teasing can have serious consequences. The mention of the 'funny name' in the context of moving to a big city where 'no one will ask' suggests that the family was seeking a fresh start where Wanda wouldn't be judged for her name or background.,,,
Descriptive,30,How does the story address the issue of social class?,"The story addresses social class by showing how Wanda's poverty and different background made her a target for teasing. She lived in Boggins Heights, wore the same dress every day, and had a 'funny' name, all of which set her apart from her classmates. The story shows how social differences can lead to exclusion and bullying. However, it also shows that class doesn't determine a person's worth, as Wanda proves to be talented, kind, and ultimately, the most graceful character in the story.,,,
Descriptive,31,What does Maddie's sleepless nights symbolize?,"Maddie's sleepless nights symbolize her troubled conscience and the psychological impact of guilt. They show that wrongdoing has consequences not just for the victim but also for the perpetrator (or in Maddie's case, the bystander). The sleepless nights represent the weight of moral responsibility and the inability to find peace when one knows they have done wrong. They symbolize the internal struggle between knowing what's right and having failed to act on it.,,,
Descriptive,32,How does the story show that it's never too late to learn?,"The story shows that it's never too late to learn through Maddie's character development. Even though Wanda is gone and Maddie can't apologize directly, she still learns valuable lessons from the experience. She recognizes her mistake, feels genuine remorse, and commits to doing better in the future. The story demonstrates that while we can't change the past, we can always learn from it and change our future behavior. It's never too late to grow and become a better person.,,,
Descriptive,33,What role do the drawings play in the resolution of the story?,"The drawings play a crucial role in the resolution: they serve as Wanda's gift of forgiveness, they prove her artistic talent, they show that she remembered her classmates, and they provide closure for Maddie and Peggy. The drawings with the girls' faces on them are particularly significant because they demonstrate that Wanda had been including them in her art all along, despite their treatment of her. The drawings bring the story to a meaningful conclusion, showing both Wanda's generosity and the girls' recognition of their wrongdoing.,,,
Descriptive,34,How does the story demonstrate the ripple effects of bullying?,"The story demonstrates ripple effects: Wanda's family moves away, the class loses a talented member, Maddie experiences lasting guilt, the entire class reflects on their behavior, and relationships are affected. The story shows that bullying doesn't just affect the immediate victim but creates a web of consequences that touches many people. These ripple effects extend beyond the school setting and can change lives in significant ways.,,,
Descriptive,35,What makes "The Hundred Dresses - II" a powerful conclusion to the story?,"Part II is a powerful conclusion because it addresses the consequences and provides resolution. It shows the real impact of bullying (Wanda's family moving), the emotional aftermath (Maddie's guilt), and the possibility of forgiveness and growth (Wanda's letter and drawings, Maddie's vow to do better). It transforms the story from simply showing bullying to teaching lessons about responsibility, forgiveness, and change. The conclusion is both realistic (not everything can be fixed) and hopeful (people can learn and grow).",,,
Descriptive,36,How does the story use symbolism effectively?,"The story uses symbolism effectively: the empty house symbolizes missed opportunities and finality, the drawings symbolize forgiveness and connection, the faces in the drawings symbolize Wanda's remembrance and inclusion, the sleepless nights symbolize guilt and conscience, and the move to the big city symbolizes a fresh start. Each symbol reinforces the story's themes and adds depth to the narrative, helping readers understand the emotional and psychological dimensions of the story.,,,
Descriptive,37,What does the story teach about the difference between being a bystander and being an upstander?,"The story teaches that being a bystander (remaining silent) can be as harmful as being a bully. Maddie learns that her silence was wrong and that she should have been an upstander (someone who stands up against bullying). The story shows that speaking up against injustice is important, even if it's difficult or risks one's own social standing. Maddie's vow to never let anyone be bullied again shows her commitment to becoming an upstander rather than a passive bystander.,,,
Descriptive,38,How does Wanda's response differ from what might be expected?,"Wanda's response differs from expectations because instead of being angry, resentful, or ignoring her former classmates, she responds with forgiveness, kindness, and generosity. Most people might expect someone who was bullied to hold a grudge or want nothing to do with their tormentors. However, Wanda chooses the higher path of forgiveness, showing maturity and grace. Her unexpected response teaches both the characters and the readers about the power of forgiveness and moving forward.,,,
Descriptive,39,What does the story reveal about the complexity of friendship and peer relationships?,"The story reveals the complexity of friendship through Maddie's relationship with Peggy. Maddie values Peggy's friendship but realizes that maintaining that friendship shouldn't come at the cost of allowing someone else to be hurt. The story shows that true friendship should include doing what's right, even if it means disagreeing with or standing up to a friend. It reveals the difficult choices young people face in peer relationships and the importance of integrity over popularity.,,,
Descriptive,40,How does the story address the theme of regret?,"The story addresses regret through Maddie's character, who deeply regrets her silence and her failure to stand up for Wanda. Her regret is shown through her physical symptoms (sick feeling, sleepless nights), her actions (trying to find Wanda, writing the letter), and her resolution to do better. The story shows that regret, while painful, can be a catalyst for positive change. Maddie's regret leads to her growth and commitment to stand up against bullying in the future.,,,
Descriptive,41,What does the story teach about the importance of words and actions?,"The story teaches that both words and actions (or lack of action) have consequences. The teasing words hurt Wanda, but Maddie's silence (lack of action) was also harmful. The story shows that what we don't do can be as significant as what we do. Wanda's actions (sending the drawings) speak louder than words and demonstrate forgiveness more powerfully than any apology could. The story emphasizes that our actions, or lack thereof, define us and affect others.,,,
Descriptive,42,How does the story show the power of kindness?,"The story shows the power of kindness through Wanda's response to her classmates. Despite being treated unkindly, she responds with kindness, sending beautiful drawings and a friendly letter. Her kindness has a transformative effect, making Maddie and Peggy reflect on their behavior and feel genuine remorse. Wanda's kindness demonstrates that responding to cruelty with kindness can be more powerful and impactful than responding in kind. It shows that kindness can change hearts and minds.,,,
Descriptive,43,What is the significance of the Christmas wish in Wanda's letter?,"The Christmas wish in Wanda's letter is significant because it shows her continuing to think of others positively, despite how they treated her. Christmas is a time associated with forgiveness, giving, and goodwill, which aligns perfectly with Wanda's message. The wish shows that Wanda holds no grudges and genuinely wishes well for her former classmates. It reinforces the theme of forgiveness and adds a note of hope and reconciliation to the story.,,,
Descriptive,44,How does the story demonstrate character growth?,"The story demonstrates character growth primarily through Maddie, who transforms from a passive bystander to someone who commits to standing up against bullying. Her journey from guilt to understanding to resolution shows significant personal growth. While she can't change the past, she learns from it and commits to being a better person in the future. This growth is realistic and meaningful, showing that people can change when they recognize their mistakes and commit to improvement.,,,
Descriptive,45,What does the story teach about the importance of speaking up?,"The story teaches that speaking up against injustice is crucial, even when it's difficult. Maddie's silence was wrong, and she learns that she should have spoken up when Wanda was being teased. The story shows that remaining silent in the face of bullying makes one complicit in the harm. It emphasizes that speaking up might be challenging, but it's the right thing to do. Maddie's vow to never let anyone be bullied again shows her commitment to speaking up in the future.,,,
Descriptive,46,How does the story address the theme of memory and remembrance?,"The story addresses memory through Wanda's drawings, which show that she remembered her classmates and included them in her art. The faces in the drawings demonstrate that Wanda had been thinking about Peggy and Maddie, remembering them despite their treatment of her. This theme shows that people remember how they are treated, and it emphasizes the lasting impact of our actions on others. Memory becomes a tool for both connection (Wanda remembering) and remorse (Maddie remembering her silence).",,
Descriptive,47,What makes the ending of the story meaningful?,"The ending is meaningful because it doesn't provide a simple, happy resolution. Wanda is gone and can't be brought back, but the story offers growth and learning. Maddie learns valuable lessons and commits to doing better. Wanda's forgiveness provides closure and shows that kindness can overcome cruelty. The ending is realistic (acknowledging that some things can't be undone) but also hopeful (showing that people can learn and grow). It leaves readers with important lessons and a sense of the importance of standing up for what's right.,,,
Descriptive,48,How does the story show that everyone has value?,"The story shows that everyone has value by revealing Wanda's talents, kindness, and character. Despite being seen as 'different' or less important because of her poverty and name, Wanda proves to be talented, creative, forgiving, and kind. The story challenges the idea that some people are worth less than others based on their background or circumstances. It teaches that every person has inherent value and deserves to be treated with respect and kindness, regardless of their social or economic status.,,,
Descriptive,49,What does the story teach about the relationship between actions and consequences?,"The story teaches that actions (and inactions) have consequences. The teasing led to Wanda's family moving away. Maddie's silence led to her guilt and regret. However, the story also shows positive consequences: Wanda's forgiveness leads to the girls' reflection and growth. The story emphasizes that we should think about the potential consequences of our actions and that doing the right thing, even if difficult, leads to better outcomes than remaining silent or participating in harmful behavior.,,,
Descriptive,50,Why is "The Hundred Dresses - II" an important story for young readers?,"The Hundred Dresses - II is important for young readers because it addresses real issues they face: bullying, peer pressure, the difficulty of speaking up, and the importance of empathy. It teaches valuable lessons about standing up for others, taking responsibility for one's actions, and the power of forgiveness. The story provides a realistic portrayal of how bullying affects everyone involved and shows that growth and change are always possible. It's particularly relevant because it addresses the role of bystanders, helping young readers understand that silence in the face of injustice is not acceptable. The story inspires readers to be upstanders rather than bystanders and to treat everyone with kindness and respect.,,,

